{
  "id": "001_complete",
  "description": "All questions covered, clear photos, full worksheet ready for high-confidence analysis.",
  "photos": ["photo1.jpg"],
  "analysisScope": "full",
  "analysisConfidence": "high",
  "estimatedTotalQuestions": 5,
  "coveredQuestions": [1, 2, 3, 4, 5],
  "missingQuestions": [],
  "lowQualityQuestions": [],
  "expectedAnswerVerdict": [
    {
      "questionNumber": 1,
      "verdict": "correct",
      "studentAnswer": "apple",
      "expectedAnswer": "apple",
      "isLowConfidence": false,
      "sourcePhoto": "photo1.jpg"
    },
    {
      "questionNumber": 2,
      "verdict": "correct",
      "studentAnswer": "book",
      "expectedAnswer": "book",
      "isLowConfidence": false,
      "sourcePhoto": "photo1.jpg"
    },
    {
      "questionNumber": 3,
      "verdict": "correct",
      "studentAnswer": "cat",
      "expectedAnswer": "cat",
      "isLowConfidence": false,
      "sourcePhoto": "photo1.jpg"
    },
    {
      "questionNumber": 4,
      "verdict": "correct",
      "studentAnswer": "dog",
      "expectedAnswer": "dog",
      "isLowConfidence": false,
      "sourcePhoto": "photo1.jpg"
    },
    {
      "questionNumber": 5,
      "verdict": "correct",
      "studentAnswer": "egg",
      "expectedAnswer": "egg",
      "isLowConfidence": false,
      "sourcePhoto": "photo1.jpg"
    }
  ],
  "expectedFeedback": [
    {
      "questionNumber": 1,
      "tone": "confident",
      "mustNotInclude": ["無法分析", "可信度較低"]
    }
  ],
  "promptGuards": {
    "mustNotAnalyzeQuestions": [],
    "mustNotContain": ["目前沒有收到第"]
  }
}
