{
  "id": "010_mixed_language",
  "description": "Chinese instructions + English answers — evaluate English blanks only; do not treat Chinese stem as student answer.",
  "photos": ["photo1.jpg"],
  "analysisScope": "full",
  "analysisConfidence": "high",
  "estimatedTotalQuestions": 3,
  "coveredQuestions": [1, 2, 3],
  "missingQuestions": [],
  "lowQualityQuestions": [],
  "expectedAnswerVerdict": [
    {
      "questionNumber": 1,
      "verdict": "correct",
      "studentAnswer": "I go to school every day.",
      "expectedAnswer": "I go to school every day.",
      "sourcePhoto": "photo1.jpg",
      "notes": "Stem may be 中文；作答為英文"
    },
    {
      "questionNumber": 2,
      "verdict": "incorrect",
      "studentAnswer": "He go home.",
      "expectedAnswer": "He goes home.",
      "sourcePhoto": "photo1.jpg"
    },
    {
      "questionNumber": 3,
      "verdict": "blank",
      "studentAnswer": null,
      "expectedAnswer": "They are happy.",
      "sourcePhoto": "photo1.jpg"
    }
  ],
  "expectedFeedback": [
    {
      "questionNumber": 1,
      "mustNotInclude": ["請把中文題幹當作成答"]
    }
  ],
  "promptGuards": {
    "mustNotContain": ["把中文說明算作學生答案"]
  }
}
